<?xml version="1.0" encoding="UTF-8"?>
<!--Créé par nmahraz, le 12/09/2022-->
<RetrieveValueSetResponse xmlns:xsi="http://www.w3.org/2001/XMLSchema-instance" xsi:schemaLocation="urn:ihe:iti:svs:2008 SVS.xsd" xmlns="urn:ihe:iti:svs:2008"><ValueSet id="1.2.250.1.213.1.1.5.482" displayName="JDV_Lateralites-CISIS" version="test"><ConceptList><Concept code="LA4306-2" displayName="Droit" codeSystem="2.16.840.1.113883.6.1" dateValid="20200101000000" dateFin="20211231000000"/><Concept code="LA4585-1" displayName="Gauche" codeSystem="2.16.840.1.113883.6.1" dateValid="20200101000000" dateFin="20211231000000"/><Concept code="LA25377-5" displayName="Bilatéral" codeSystem="2.16.840.1.113883.6.1" dateValid="20200101000000" dateFin="20211231000000"/><Concept code="LA25378-3" displayName="Unilatéral" codeSystem="2.16.840.1.113883.6.1" dateValid="20200101000000" dateFin="20211231000000"/><Concept code="LA4720-4" displayName="Non applicable" codeSystem="2.16.840.1.113883.6.1" dateValid="20200101000000" dateFin="20211231000000"/></ConceptList></ValueSet></RetrieveValueSetResponse>
