<?xml version="1.0" encoding="UTF-8"?>
<!--Créé par nmahraz, le 12/09/2022-->
<RetrieveValueSetResponse xmlns:xsi="http://www.w3.org/2001/XMLSchema-instance" xsi:schemaLocation="urn:ihe:iti:svs:2008 SVS.xsd" xmlns="urn:ihe:iti:svs:2008"><ValueSet id="1.2.250.1.213.1.1.5.656" displayName="JDV_MesureLentilleDelivree-CISIS" version="test"><ConceptList><Concept code="11778-8" displayName="Date De délivrance" codeSystem="2.16.840.1.113883.6.1" dateValid="20210924000000" dateFin=""/><Concept code="80418-7" displayName="Produit d'entretien" codeSystem="2.16.840.1.113883.6.1" dateValid="20210924000000" dateFin=""/><Concept code="28866-2" displayName="Type de lentille" codeSystem="2.16.840.1.113883.6.1" dateValid="20210924000000" dateFin=""/><Concept code="GEN-292" displayName="Commentaire" codeSystem="1.2.250.1.213.1.1.4.322" dateValid="20210924000000" dateFin=""/><Concept code="C53610" displayName="Renouvellement" codeSystem="2.16.840.1.113883.3.26.1.1" dateValid="20210924000000" dateFin=""/><Concept code="C43383" displayName="Marque et Modèle" codeSystem="2.16.840.1.113883.3.26.1.1" dateValid="20210924000000" dateFin=""/><Concept code="MED-1089" displayName="Diamètre lentille – lentille délivrée" codeSystem="1.2.250.1.213.1.1.4.322" dateValid="20210924000000" dateFin=""/><Concept code="MED-1090" displayName="Rayon 1 lentille – lentille délivrée" codeSystem="1.2.250.1.213.1.1.4.322" dateValid="20210924000000" dateFin=""/><Concept code="MED-1091" displayName="Rayon 2 lentille – lentille délivrée" codeSystem="1.2.250.1.213.1.1.4.322" dateValid="20210924000000" dateFin=""/><Concept code="MED-896" displayName="Autres paramètres" codeSystem="1.2.250.1.213.1.1.4.322" dateValid="20210924000000" dateFin=""/><Concept code="MED-1092" displayName="Puissance de la sphère – lentille délivrée" codeSystem="1.2.250.1.213.1.1.4.322" dateValid="20210924000000" dateFin=""/><Concept code="MED-1093" displayName="Puissance du cylindre – lentille délivrée" codeSystem="1.2.250.1.213.1.1.4.322" dateValid="20210924000000" dateFin=""/><Concept code="95325-7" displayName="Axe en degrés des lentilles" codeSystem="2.16.840.1.113883.6.1" dateValid="20210924000000" dateFin=""/><Concept code="28814-2" displayName="Addition – grandeur" codeSystem="2.16.840.1.113883.6.1" dateValid="20210924000000" dateFin=""/><Concept code="28815-9" displayName="Addition – valeur" codeSystem="2.16.840.1.113883.6.1" dateValid="20210924000000" dateFin=""/></ConceptList></ValueSet></RetrieveValueSetResponse>
