<?xml version="1.0" encoding="ISO-8859-1"?>
<!--Créé par nmahraz, le 09/03/2022-->
<RetrieveValueSetResponse xmlns:xsi="http://www.w3.org/2001/XMLSchema-instance" xsi:schemaLocation="urn:ihe:iti:svs:2008 SVS.xsd" xmlns="urn:ihe:iti:svs:2008"><ValueSet id="1.2.250.1.213.1.1.5.127" displayName="JDV_TypeService-CISIS" version="test"><ConceptList><Concept code="ORG-139" displayName="Réanimation" codeSystem="1.2.250.1.213.1.1.4.322"/><Concept code="ORG-140" displayName="Néonatologie" codeSystem="1.2.250.1.213.1.1.4.322"/><Concept code="ORG-141" displayName="Unité Kangourou" codeSystem="1.2.250.1.213.1.1.4.322"/><Concept code="ORG-142" displayName="Unité de soin intensif en néonatalogie (USIN)" codeSystem="1.2.250.1.213.1.1.4.322"/><Concept code="GEN-097" displayName="Autre (préciser)" codeSystem="1.2.250.1.213.1.1.4.322"/></ConceptList></ValueSet></RetrieveValueSetResponse>
