<?xml version="1.0" encoding="UTF-8"?>
<!--Créé par nmahraz, le 12/09/2022-->
<RetrieveValueSetResponse xmlns:xsi="http://www.w3.org/2001/XMLSchema-instance" xsi:schemaLocation="urn:ihe:iti:svs:2008 SVS.xsd" xmlns="urn:ihe:iti:svs:2008"><ValueSet id="1.2.250.1.213.1.1.4.2.289.21" displayName="JDV_OBP_LieuAccouchement-CISIS" version="test"><ConceptList><Concept code="OBS_201" displayName="Maternité" codeSystem="1.2.250.1.213.1.1.4.2.289" dateValid="20100101000000" dateFin=""/><Concept code="OBS_202" displayName="Domicile" codeSystem="1.2.250.1.213.1.1.4.2.289" dateValid="20100101000000" dateFin=""/><Concept code="OBS_203" displayName="Autre maternité" codeSystem="1.2.250.1.213.1.1.4.2.289" dateValid="20100101000000" dateFin="20220413000000"/><Concept code="OBS_204" displayName="Autre lieu" codeSystem="1.2.250.1.213.1.1.4.2.289" dateValid="20100101000000" dateFin="20220413000000"/><Concept code="GEN-092" displayName="Autre" codeSystem="1.2.250.1.213.1.1.4.322" dateValid="20220413000000" dateFin=""/></ConceptList></ValueSet></RetrieveValueSetResponse>
