<?xml version="1.0" encoding="UTF-8"?>
<!--Créé par nmahraz, le 12/09/2022-->
<RetrieveValueSetResponse xmlns:xsi="http://www.w3.org/2001/XMLSchema-instance" xsi:schemaLocation="urn:ihe:iti:svs:2008 SVS.xsd" xmlns="urn:ihe:iti:svs:2008"><ValueSet id="1.2.250.1.213.1.1.4.2.13" displayName="JDV_UFCV_MotImpl-CISIS" version="test"><ConceptList><Concept code="D0016-6" displayName="Prévention primaire d'un sujet à haut risque" codeSystem="1.2.250.1.213.1.1.4.2" dateValid="20100101000000" dateFin=""/><Concept code="G45.9" displayName="Accident ischémique cérébral transitoire" codeSystem="2.16.840.1.113883.6.3" dateValid="20100101000000" dateFin=""/><Concept code="I20.9" displayName="Syndrome Angineux" codeSystem="2.16.840.1.113883.6.3" dateValid="20100101000000" dateFin=""/><Concept code="I64" displayName="Accident cérébrovasculaire" codeSystem="2.16.840.1.113883.6.3" dateValid="20100101000000" dateFin=""/><Concept code="I65.2" displayName="Sténose de l'artère carotide" codeSystem="2.16.840.1.113883.6.3" dateValid="20100101000000" dateFin=""/><Concept code="I74.3" displayName="Thrombose progressive des artères des membres inférieurs" codeSystem="2.16.840.1.113883.6.3" dateValid="20100101000000" dateFin=""/><Concept code="I74.4" displayName="Embolie et thrombose des artères distales" codeSystem="2.16.840.1.113883.6.3" dateValid="20100101000000" dateFin=""/><Concept code="K55.0" displayName="Artérite Mésentérique" codeSystem="2.16.840.1.113883.6.3" dateValid="20100101000000" dateFin=""/><Concept code="N28.0" displayName="Occlusion et thrombose de l'artère rénale" codeSystem="2.16.840.1.113883.6.3" dateValid="20100101000000" dateFin=""/></ConceptList></ValueSet></RetrieveValueSetResponse>
