<?xml version="1.0" encoding="UTF-8"?>
<!--Créé par nmahraz, le 12/09/2022-->
<RetrieveValueSetResponse xmlns:xsi="http://www.w3.org/2001/XMLSchema-instance" xsi:schemaLocation="urn:ihe:iti:svs:2008 SVS.xsd" xmlns="urn:ihe:iti:svs:2008"><ValueSet id="1.2.250.1.213.1.1.5.643" displayName="JDV_TypeDeMesureDispositifOculaire-CISIS" version="test"><ConceptList><Concept code="28821-7" displayName="Verres prescrits" codeSystem="2.16.840.1.113883.6.1" dateValid="20210622000000" dateFin=""/><Concept code="28818-3" displayName="Types de verres prescrits" codeSystem="2.16.840.1.113883.6.1" dateValid="20210622000000" dateFin=""/><Concept code="MED-1067" displayName="Verres délivrés" codeSystem="1.2.250.1.213.1.1.4.322" dateValid="20210622000000" dateFin=""/><Concept code="MED-1068" displayName="Types de verres délivrés" codeSystem="1.2.250.1.213.1.1.4.322" dateValid="20210622000000" dateFin=""/><Concept code="28866-2" displayName="Lentilles prescrites" codeSystem="2.16.840.1.113883.6.1" dateValid="20210622000000" dateFin=""/><Concept code="MED-1069" displayName="Lentilles délivrées" codeSystem="1.2.250.1.213.1.1.4.322" dateValid="20210622000000" dateFin=""/></ConceptList></ValueSet></RetrieveValueSetResponse>
