<?xml version="1.0" encoding="UTF-8"?>
<!--Créé par nmahraz, le 12/09/2022-->
<RetrieveValueSetResponse xmlns:xsi="http://www.w3.org/2001/XMLSchema-instance" xsi:schemaLocation="urn:ihe:iti:svs:2008 SVS.xsd" xmlns="urn:ihe:iti:svs:2008"><ValueSet id="1.2.250.1.213.1.1.5.246" displayName="JDV_Col-Uterus-Type-histologique-lesion-neoplasique-in-situ-CISIS" version="test"><ConceptList><Concept code="1663" displayName="Néoplasie cervicale intra-épithéliale de haut grade (CIN3)" codeSystem="1.3.6.1.4.1.19376.1.8.2.1" dateValid="20100101000000" dateFin=""/><Concept code="1664" displayName="Néoplasie cervicale intra-épithéliale de grade intermédiaire (CIN2)" codeSystem="1.3.6.1.4.1.19376.1.8.2.1" dateValid="20100101000000" dateFin=""/><Concept code="1665" displayName="Néoplasie cervicale intra-épithéliale de bas grade (CIN1)" codeSystem="1.3.6.1.4.1.19376.1.8.2.1" dateValid="20100101000000" dateFin=""/><Concept code="1666" displayName="Condylome acuminé ou plan" codeSystem="1.3.6.1.4.1.19376.1.8.2.1" dateValid="20100101000000" dateFin=""/><Concept code="1667" displayName="Carcinome épidermoide in situ" codeSystem="1.3.6.1.4.1.19376.1.8.2.1" dateValid="20100101000000" dateFin=""/><Concept code="1668" displayName="Dysplasie glandulaire, atypies des cellules glandulaires" codeSystem="1.3.6.1.4.1.19376.1.8.2.1" dateValid="20100101000000" dateFin=""/><Concept code="1669" displayName="Adénocarcinome endocervical in situ" codeSystem="1.3.6.1.4.1.19376.1.8.2.1" dateValid="20100101000000" dateFin=""/></ConceptList></ValueSet></RetrieveValueSetResponse>
