<?xml version="1.0" encoding="ISO-8859-1"?>
<!--Créé par nmahraz, le 05/07/2022-->
<RetrieveValueSetResponse xmlns:xsi="http://www.w3.org/2001/XMLSchema-instance" xsi:schemaLocation="urn:ihe:iti:svs:2008 SVS.xsd" xmlns="urn:ihe:iti:svs:2008"><ValueSet id="1.2.250.1.213.1.1.5.397" displayName="JDV_Prostate-Grade-histologique-Gleason-Composante-plus-pejorative-CISIS" version="test"><ConceptList><Concept code="1017" displayName="Grade 1" codeSystem="1.3.6.1.4.1.19376.1.8.2.1" dateValid="20100101000000" dateFin=""/><Concept code="1018" displayName="Grade 2" codeSystem="1.3.6.1.4.1.19376.1.8.2.1" dateValid="20100101000000" dateFin=""/><Concept code="1019" displayName="Grade 3" codeSystem="1.3.6.1.4.1.19376.1.8.2.1" dateValid="20100101000000" dateFin=""/><Concept code="1020" displayName="Grade 4" codeSystem="1.3.6.1.4.1.19376.1.8.2.1" dateValid="20100101000000" dateFin=""/><Concept code="1021" displayName="Grade 5" codeSystem="1.3.6.1.4.1.19376.1.8.2.1" dateValid="20100101000000" dateFin=""/></ConceptList></ValueSet></RetrieveValueSetResponse>
