<?xml version="1.0" encoding="UTF-8"?>
<!--Créé par nmahraz, le 12/09/2022-->
<RetrieveValueSetResponse xmlns:xsi="http://www.w3.org/2001/XMLSchema-instance" xsi:schemaLocation="urn:ihe:iti:svs:2008 SVS.xsd" xmlns="urn:ihe:iti:svs:2008"><ValueSet id="1.2.250.1.213.1.1.5.376" displayName="JDV_Pharynx-Observation-anatomie-pathologique-CISIS" version="test"><ConceptList><Concept code="335" displayName="Pharynx-Atteinte des limites de résection par la tumeur in situ" codeSystem="1.3.6.1.4.1.19376.1.8.2.1" dateValid="20100101000000" dateFin=""/><Concept code="336" displayName="Pharynx-Atteinte des limites de résection par la tumeur maligne invasive" codeSystem="1.3.6.1.4.1.19376.1.8.2.1" dateValid="20100101000000" dateFin=""/><Concept code="337" displayName="Pharynx-Distance tumeur in situ/plus proche limite de résection" codeSystem="1.3.6.1.4.1.19376.1.8.2.1" dateValid="20100101000000" dateFin=""/><Concept code="338" displayName="Pharynx-Distance tumeur maligne invasive/plus proche limite de résection" codeSystem="1.3.6.1.4.1.19376.1.8.2.1" dateValid="20100101000000" dateFin=""/><Concept code="339" displayName="Pharynx-Emboles vasculaires" codeSystem="1.3.6.1.4.1.19376.1.8.2.1" dateValid="20100101000000" dateFin=""/><Concept code="340" displayName="Pharynx-Extension microscopique et macroscopique de la tumeur" codeSystem="1.3.6.1.4.1.19376.1.8.2.1" dateValid="20100101000000" dateFin=""/><Concept code="341" displayName="Pharynx-Infiltration péri-nerveuse" codeSystem="1.3.6.1.4.1.19376.1.8.2.1" dateValid="20100101000000" dateFin=""/><Concept code="342" displayName="Pharynx-Invasion de la capsule" codeSystem="1.3.6.1.4.1.19376.1.8.2.1" dateValid="20100101000000" dateFin=""/><Concept code="343" displayName="Pharynx-Localisation de la tumeur dans l'organe" codeSystem="1.3.6.1.4.1.19376.1.8.2.1" dateValid="20100101000000" dateFin=""/><Concept code="344" displayName="Pharynx-Localisation de(s) ganglion(s)" codeSystem="1.3.6.1.4.1.19376.1.8.2.1" dateValid="20100101000000" dateFin=""/><Concept code="345" displayName="Pharynx-Nombre de ganglion(s) envahi(s)" codeSystem="1.3.6.1.4.1.19376.1.8.2.1" dateValid="20100101000000" dateFin=""/><Concept code="346" displayName="Pharynx-Nombre de ganglion(s) examiné(s)" codeSystem="1.3.6.1.4.1.19376.1.8.2.1" dateValid="20100101000000" dateFin=""/><Concept code="347" displayName="Pharynx-Organe-region-prelevement-CISIS" codeSystem="1.3.6.1.4.1.19376.1.8.2.1" dateValid="20100101000000" dateFin=""/><Concept code="348" displayName="Pharynx-pN carcinome hypoPharynx" codeSystem="1.3.6.1.4.1.19376.1.8.2.1" dateValid="20100101000000" dateFin=""/><Concept code="349" displayName="Pharynx-pN carcinome nasoPharynx" codeSystem="1.3.6.1.4.1.19376.1.8.2.1" dateValid="20100101000000" dateFin=""/><Concept code="350" displayName="Pharynx-pN mélanome muqueux malin" codeSystem="1.3.6.1.4.1.19376.1.8.2.1" dateValid="20100101000000" dateFin=""/><Concept code="351" displayName="Pharynx-Procédure de prélèvement" codeSystem="1.3.6.1.4.1.19376.1.8.2.1" dateValid="20100101000000" dateFin=""/><Concept code="352" displayName="Pharynx-pT carcinome hypoPharynx" codeSystem="1.3.6.1.4.1.19376.1.8.2.1" dateValid="20100101000000" dateFin=""/><Concept code="353" displayName="Pharynx-pT carcinome nasoPharynx" codeSystem="1.3.6.1.4.1.19376.1.8.2.1" dateValid="20100101000000" dateFin=""/><Concept code="354" displayName="Pharynx-pT mélanome muqueux malin" codeSystem="1.3.6.1.4.1.19376.1.8.2.1" dateValid="20100101000000" dateFin=""/><Concept code="355" displayName="Pharynx-Taille de la métastase ganglionnaire" codeSystem="1.3.6.1.4.1.19376.1.8.2.1" dateValid="20100101000000" dateFin=""/><Concept code="356" displayName="Pharynx-Taille de tumeur maligne invasive (plus grande dimension)" codeSystem="1.3.6.1.4.1.19376.1.8.2.1" dateValid="20100101000000" dateFin=""/><Concept code="357" displayName="Pharynx-Taille du prélèvement (plus grande dimension)" codeSystem="1.3.6.1.4.1.19376.1.8.2.1" dateValid="20100101000000" dateFin=""/><Concept code="358" displayName="Pharynx-Type-histologique-lesion-neoplasique-maligne-invasive-CISIS" codeSystem="1.3.6.1.4.1.19376.1.8.2.1" dateValid="20100101000000" dateFin=""/></ConceptList></ValueSet></RetrieveValueSetResponse>
