<?xml version="1.0" encoding="UTF-8"?>
<!--Créé par nmahraz, le 12/09/2022-->
<RetrieveValueSetResponse xmlns:xsi="http://www.w3.org/2001/XMLSchema-instance" xsi:schemaLocation="urn:ihe:iti:svs:2008 SVS.xsd" xmlns="urn:ihe:iti:svs:2008"><ValueSet id="1.2.250.1.213.1.1.5.151" displayName="JDV_MethodePreparationEchantillon-CISIS" version="test"><ConceptList><Concept code="MED-302" displayName="Macro dissection de la zone d’intérêt" codeSystem="1.2.250.1.213.1.1.4.322" dateValid="20100101000000" dateFin=""/><Concept code="MED-303" displayName="Punch du bloc tumoral" codeSystem="1.2.250.1.213.1.1.4.322" dateValid="20100101000000" dateFin=""/><Concept code="MED-304" displayName="Production de copeaux de paraffines à partir du bloc tumoral" codeSystem="1.2.250.1.213.1.1.4.322" dateValid="20100101000000" dateFin=""/><Concept code="MED-305" displayName="Traitement de lames de cytologie" codeSystem="1.2.250.1.213.1.1.4.322" dateValid="20100101000000" dateFin=""/><Concept code="GEN-097" displayName="Autre (préciser)" codeSystem="1.2.250.1.213.1.1.4.322" dateValid="20100101000000" dateFin="20220413000000"/><Concept code="GEN-092" displayName="Autre" codeSystem="1.2.250.1.213.1.1.4.322" dateValid="20220413000000" dateFin=""/></ConceptList></ValueSet></RetrieveValueSetResponse>
