<?xml version="1.0" encoding="UTF-8"?>
<!--Créé par nmahraz, le 12/09/2022-->
<RetrieveValueSetResponse xmlns:xsi="http://www.w3.org/2001/XMLSchema-instance" xsi:schemaLocation="urn:ihe:iti:svs:2008 SVS.xsd" xmlns="urn:ihe:iti:svs:2008"><ValueSet id="1.2.250.1.213.1.1.5.102" displayName="JDV_BatterieExamen-CISIS" version="test"><ConceptList><Concept code="GEN-078" displayName="Dépistage de la trisomie 21" codeSystem="1.2.250.1.213.1.1.4.322" dateValid="20100101000000" dateFin=""/><Concept code="ORG-079" displayName="Nombre total d'échographies" codeSystem="1.2.250.1.213.1.1.4.322" dateValid="20100101000000" dateFin=""/><Concept code="ORG-080" displayName="Echographie morphologique" codeSystem="1.2.250.1.213.1.1.4.322" dateValid="20100101000000" dateFin=""/><Concept code="51659-1" displayName="Hépatite B virus surface Ag" codeSystem="2.16.840.1.113883.6.1" dateValid="20100101000000" dateFin=""/><Concept code="GEN-079" displayName="Entretien prénatal précoce" codeSystem="1.2.250.1.213.1.1.4.322" dateValid="20100101000000" dateFin=""/></ConceptList></ValueSet></RetrieveValueSetResponse>
