<?xml version="1.0" encoding="ISO-8859-1"?>
<!--Créé par nmahraz, le 09/03/2022-->
<RetrieveValueSetResponse xmlns:xsi="http://www.w3.org/2001/XMLSchema-instance" xsi:schemaLocation="urn:ihe:iti:svs:2008 SVS.xsd" xmlns="urn:ihe:iti:svs:2008"><ValueSet id="1.2.250.1.213.1.1.5.411" displayName="JDV_Rein-Observation-anatomie-pathologique-CISIS" version="test"><ConceptList><Concept code="398" displayName="Rein-Atteinte des limites de résection par la tumeur maligne invasive" codeSystem="1.3.6.1.4.1.19376.1.8.2.1"/><Concept code="399" displayName="Rein-Distance tumeur maligne invasive/plus proche limite de résection" codeSystem="1.3.6.1.4.1.19376.1.8.2.1"/><Concept code="400" displayName="Rein-Emboles vasculaires" codeSystem="1.3.6.1.4.1.19376.1.8.2.1"/><Concept code="401" displayName="Rein-Extension microscopique et macroscopique de la tumeur" codeSystem="1.3.6.1.4.1.19376.1.8.2.1"/><Concept code="402" displayName="Rein-Grade histologique (Fuhrman)" codeSystem="1.3.6.1.4.1.19376.1.8.2.1"/><Concept code="403" displayName="Rein-Localisation de la tumeur dans l'organe" codeSystem="1.3.6.1.4.1.19376.1.8.2.1"/><Concept code="404" displayName="Rein-Localisation de(s) limite(s) de résection" codeSystem="1.3.6.1.4.1.19376.1.8.2.1"/><Concept code="405" displayName="Rein-Nombre de ganglion(s) envahi(s)" codeSystem="1.3.6.1.4.1.19376.1.8.2.1"/><Concept code="406" displayName="Rein-Nombre de ganglion(s) examiné(s)" codeSystem="1.3.6.1.4.1.19376.1.8.2.1"/><Concept code="407" displayName="Rein-Organe-region-prelevement-CISIS" codeSystem="1.3.6.1.4.1.19376.1.8.2.1"/><Concept code="408" displayName="Rein-pN" codeSystem="1.3.6.1.4.1.19376.1.8.2.1"/><Concept code="409" displayName="Rein-Procédure de prélèvement" codeSystem="1.3.6.1.4.1.19376.1.8.2.1"/><Concept code="410" displayName="Rein-pT" codeSystem="1.3.6.1.4.1.19376.1.8.2.1"/><Concept code="411" displayName="Rein-Taille de tumeur maligne invasive (plus grande dimension)" codeSystem="1.3.6.1.4.1.19376.1.8.2.1"/><Concept code="412" displayName="Rein-Type-histologique-lesion-neoplasique-maligne-invasive-CISIS" codeSystem="1.3.6.1.4.1.19376.1.8.2.1"/></ConceptList></ValueSet></RetrieveValueSetResponse>
