<?xml version="1.0" encoding="ISO-8859-1"?>
<!--Créé par nmahraz, le 09/03/2022-->
<RetrieveValueSetResponse xmlns:xsi="http://www.w3.org/2001/XMLSchema-instance" xsi:schemaLocation="urn:ihe:iti:svs:2008 SVS.xsd" xmlns="urn:ihe:iti:svs:2008"><ValueSet id="1.2.250.1.213.1.1.4.2.289.18" displayName="JDV_OBP_AspectLA-CISIS" version="test"><ConceptList><Concept code="G-A456" displayName="Clair" codeSystem="1.2.250.1.213.2.12"/><Concept code="OBS_216" displayName="Teinté (méconial fluide)" codeSystem="1.2.250.1.213.1.1.4.2.289"/><Concept code="OBS_217" displayName="Méconial épais" codeSystem="1.2.250.1.213.1.1.4.2.289"/><Concept code="OBS_218" displayName="Sanglant" codeSystem="1.2.250.1.213.1.1.4.2.289"/><Concept code="OBS_219" displayName="Autre aspect du liquide amniotique" codeSystem="1.2.250.1.213.1.1.4.2.289"/></ConceptList></ValueSet></RetrieveValueSetResponse>
