<?xml version="1.0" encoding="ISO-8859-1"?>
<!--Créé par nmahraz, le 09/03/2022-->
<RetrieveValueSetResponse xmlns:xsi="http://www.w3.org/2001/XMLSchema-instance" xsi:schemaLocation="urn:ihe:iti:svs:2008 SVS.xsd" xmlns="urn:ihe:iti:svs:2008"><ValueSet id="1.2.250.1.213.1.1.4.2.289.46" displayName="JDV_OBP_StaticSAPActiveProblem-CISIS" version="test"><ConceptList><Concept code="D7-10030" displayName="Infection urinaire" codeSystem="1.2.250.1.213.2.12"/><Concept code="D8-11000" displayName="Hypertension artérielle" codeSystem="1.2.250.1.213.2.12"/><Concept code="D8-12000" displayName="Menace d'accouchement prématuré" codeSystem="1.2.250.1.213.2.12"/><Concept code="E14" displayName="Diabète" codeSystem="2.16.840.1.113883.6.3"/><Concept code="OBS_016" displayName="Métrorragies du 2ème- 3ème trimestre" codeSystem="1.2.250.1.213.1.1.4.2.289"/><Concept code="OBS_017" displayName="Rupture prématurée des membranes" codeSystem="1.2.250.1.213.1.1.4.2.289"/><Concept code="OBS_019" displayName="Autres pathologies maternelles" codeSystem="1.2.250.1.213.1.1.4.2.289"/><Concept code="OBS_132" displayName="Infection cervico-vaginale" codeSystem="1.2.250.1.213.1.1.4.2.289"/></ConceptList></ValueSet></RetrieveValueSetResponse>
