<?xml version="1.0" encoding="UTF-8"?>
<!--Créé par nmahraz, le 12/09/2022-->
<RetrieveValueSetResponse xmlns:xsi="http://www.w3.org/2001/XMLSchema-instance" xsi:schemaLocation="urn:ihe:iti:svs:2008 SVS.xsd" xmlns="urn:ihe:iti:svs:2008"><ValueSet id="1.2.250.1.213.1.1.5.551" displayName="JDV_TNM_pTNM_pN_CISIS" version="test"><ConceptList><Concept code="MED-795" displayName="Ganglions  lymphatiques régionaux non évaluables" codeSystem="1.2.250.1.213.1.1.4.322" dateValid="20210101000000" dateFin=""/><Concept code="MED-796" displayName="Pas de métastase ganglionnaire lymphatique régionale" codeSystem="1.2.250.1.213.1.1.4.322" dateValid="20210101000000" dateFin=""/><Concept code="MED-797" displayName="Métastase dans 1 ganglion lymphatique régional" codeSystem="1.2.250.1.213.1.1.4.322" dateValid="20210101000000" dateFin=""/><Concept code="MED-798" displayName="Métastases dans 2 ou 3 ganglions lymphatiques régionaux" codeSystem="1.2.250.1.213.1.1.4.322" dateValid="20210101000000" dateFin=""/><Concept code="MED-799" displayName="Présence de dépôt(s) tumoral(aux) sans métastase ganglionnaire lymphatique régionale" codeSystem="1.2.250.1.213.1.1.4.322" dateValid="20210101000000" dateFin=""/><Concept code="MED-800" displayName="Métastases dans 4 à 6 ganglions lymphatiques régionaux" codeSystem="1.2.250.1.213.1.1.4.322" dateValid="20210101000000" dateFin=""/><Concept code="MED-801" displayName="Métastases dans plus de 6 ganglions lymphatiques régionaux" codeSystem="1.2.250.1.213.1.1.4.322" dateValid="20210101000000" dateFin=""/></ConceptList></ValueSet></RetrieveValueSetResponse>
