<?xml version="1.0" encoding="UTF-8"?>
<!--Créé par nmahraz, le 12/09/2022-->
<RetrieveValueSetResponse xmlns:xsi="http://www.w3.org/2001/XMLSchema-instance" xsi:schemaLocation="urn:ihe:iti:svs:2008 SVS.xsd" xmlns="urn:ihe:iti:svs:2008"><ValueSet id="1.2.250.1.213.1.1.5.231" displayName="JDV_TypePriseEnCharge-CISIS" version="test"><ConceptList><Concept code="ORG-165" displayName="Séjour de répit" codeSystem="1.2.250.1.213.1.1.4.322" dateValid="20100101000000" dateFin=""/><Concept code="ORG-166" displayName="Maison d'accueil spécialisé (MAS) / Foyer d'accueil médicalisé (FAM)" codeSystem="1.2.250.1.213.1.1.4.322" dateValid="20100101000000" dateFin=""/><Concept code="ORG-167" displayName="Hospitalisation complète" codeSystem="1.2.250.1.213.1.1.4.322" dateValid="20100101000000" dateFin=""/><Concept code="ORG-072" displayName="Hospitalisation à domicile (HAD)" codeSystem="1.2.250.1.213.1.1.4.322" dateValid="20100101000000" dateFin=""/><Concept code="ORG-044" displayName="Hôpital de jour (HDJ)" codeSystem="1.2.250.1.213.1.1.4.322" dateValid="20100101000000" dateFin=""/><Concept code="ORG-168" displayName="Services de soins infirmiers à domicile (SSIAD)" codeSystem="1.2.250.1.213.1.1.4.322" dateValid="20100101000000" dateFin=""/><Concept code="GEN-092" displayName="Autre" codeSystem="1.2.250.1.213.1.1.4.322" dateValid="20100101000000" dateFin=""/></ConceptList></ValueSet></RetrieveValueSetResponse>
