<?xml version="1.0" encoding="UTF-8"?>
<!--Créé par nmahraz, le 12/09/2022-->
<RetrieveValueSetResponse xmlns:xsi="http://www.w3.org/2001/XMLSchema-instance" xsi:schemaLocation="urn:ihe:iti:svs:2008 SVS.xsd" xmlns="urn:ihe:iti:svs:2008"><ValueSet id="1.2.250.1.213.1.1.5.354" displayName="JDV_Ovaire-Type-histologique-lesion-neoplasique-maligne-invasive-CISIS" version="test"><ConceptList><Concept code="602" displayName="Tumeur épithéliale séreuse borderline" codeSystem="1.3.6.1.4.1.19376.1.8.2.1" dateValid="20100101000000" dateFin=""/><Concept code="603" displayName="Adenocarcinome séreux" codeSystem="1.3.6.1.4.1.19376.1.8.2.1" dateValid="20100101000000" dateFin=""/><Concept code="604" displayName="Tumeur épithéliale mucineuse" codeSystem="1.3.6.1.4.1.19376.1.8.2.1" dateValid="20100101000000" dateFin=""/><Concept code="605" displayName="Adénocarcinome mucineux" codeSystem="1.3.6.1.4.1.19376.1.8.2.1" dateValid="20100101000000" dateFin=""/><Concept code="606" displayName="Tumeur épithéliale endométrioïde borderline" codeSystem="1.3.6.1.4.1.19376.1.8.2.1" dateValid="20100101000000" dateFin=""/><Concept code="607" displayName="Adénocarcinome endometrioide" codeSystem="1.3.6.1.4.1.19376.1.8.2.1" dateValid="20100101000000" dateFin=""/><Concept code="608" displayName="Tumeur épithéliale à cellules claires borderline" codeSystem="1.3.6.1.4.1.19376.1.8.2.1" dateValid="20100101000000" dateFin=""/><Concept code="609" displayName="Carcinome à cellules claires" codeSystem="1.3.6.1.4.1.19376.1.8.2.1" dateValid="20100101000000" dateFin=""/><Concept code="610" displayName="Tumeur épithéliale à cellules transitionnelles borderline (tumeur de Brenner)" codeSystem="1.3.6.1.4.1.19376.1.8.2.1" dateValid="20100101000000" dateFin=""/><Concept code="611" displayName="Carcinome à cellules transitionnelles" codeSystem="1.3.6.1.4.1.19376.1.8.2.1" dateValid="20100101000000" dateFin=""/><Concept code="612" displayName="Tumeur épithéliale carcinome indifférencié" codeSystem="1.3.6.1.4.1.19376.1.8.2.1" dateValid="20100101000000" dateFin=""/><Concept code="613" displayName="Tumeur épithéliale autre" codeSystem="1.3.6.1.4.1.19376.1.8.2.1" dateValid="20100101000000" dateFin=""/><Concept code="614" displayName="Tumeur de Sertoli Leydig" codeSystem="1.3.6.1.4.1.19376.1.8.2.1" dateValid="20100101000000" dateFin=""/><Concept code="615" displayName="Tumeur de la granulosa adulte" codeSystem="1.3.6.1.4.1.19376.1.8.2.1" dateValid="20100101000000" dateFin=""/><Concept code="616" displayName="Tumeur de la granulosa juvénile" codeSystem="1.3.6.1.4.1.19376.1.8.2.1" dateValid="20100101000000" dateFin=""/><Concept code="617" displayName="Tumeur du stroma et des cordons sexuels autre" codeSystem="1.3.6.1.4.1.19376.1.8.2.1" dateValid="20100101000000" dateFin=""/><Concept code="618" displayName="Tumeur germinale : préciser" codeSystem="1.3.6.1.4.1.19376.1.8.2.1" dateValid="20100101000000" dateFin=""/><Concept code="619" displayName="Fibrosarcome" codeSystem="1.3.6.1.4.1.19376.1.8.2.1" dateValid="20100101000000" dateFin=""/></ConceptList></ValueSet></RetrieveValueSetResponse>
