<?xml version="1.0" encoding="UTF-8"?>
<!--Créé par nmahraz, le 12/09/2022-->
<RetrieveValueSetResponse xmlns:xsi="http://www.w3.org/2001/XMLSchema-instance" xsi:schemaLocation="urn:ihe:iti:svs:2008 SVS.xsd" xmlns="urn:ihe:iti:svs:2008"><ValueSet id="1.2.250.1.213.1.1.5.267" displayName="JDV_Corps-uterin-pT-CISIS" version="test"><ConceptList><Concept code="585" displayName="pT0 [--]: No evidence of primary tumor" codeSystem="1.3.6.1.4.1.19376.1.8.2.1" dateValid="20100101000000" dateFin=""/><Concept code="586" displayName="pT1a [IA]: Tumor limited to endometrium or invades less than one-half of the myometrium" codeSystem="1.3.6.1.4.1.19376.1.8.2.1" dateValid="20100101000000" dateFin=""/><Concept code="587" displayName="pT1b [IB]: Tumor invades greater than or equal to one-half of the myometrium" codeSystem="1.3.6.1.4.1.19376.1.8.2.1" dateValid="20100101000000" dateFin=""/><Concept code="588" displayName="pT2 [II]: Tumor invades stromal connective tissue of the cervix, but does not extend beyond uterus" codeSystem="1.3.6.1.4.1.19376.1.8.2.1" dateValid="20100101000000" dateFin=""/><Concept code="589" displayName="pT3a [IIIA]: Tumor involves serosa and/or adnexa (direct extension or metastasis)" codeSystem="1.3.6.1.4.1.19376.1.8.2.1" dateValid="20100101000000" dateFin=""/><Concept code="590" displayName="pT3b [IIIB]: Vaginal involvement (direct extension or metastasis) or parametrial involvement" codeSystem="1.3.6.1.4.1.19376.1.8.2.1" dateValid="20100101000000" dateFin=""/><Concept code="591" displayName="pT4 [IVA]: Tumor invades bladder mucosa and/or bowel mucosa (bullous edema is not sufficient to classify a tumor as T4)" codeSystem="1.3.6.1.4.1.19376.1.8.2.1" dateValid="20100101000000" dateFin=""/></ConceptList></ValueSet></RetrieveValueSetResponse>
