<?xml version="1.0" encoding="UTF-8"?>
<!--Créé par nmahraz, le 12/09/2022-->
<RetrieveValueSetResponse xmlns:xsi="http://www.w3.org/2001/XMLSchema-instance" xsi:schemaLocation="urn:ihe:iti:svs:2008 SVS.xsd" xmlns="urn:ihe:iti:svs:2008"><ValueSet id="2.16.840.1.113883.5.7" displayName="JDV_HL7_ActPriority-CISIS" version="test"><ConceptList><Concept code="A" displayName="Aussi vite que possible" codeSystem="2.16.840.1.113883.5.7" dateValid="20100101000000" dateFin=""/><Concept code="EL" displayName="Bénéfique pour le patient mais pas essentiel pour sa survie" codeSystem="2.16.840.1.113883.5.7" dateValid="20100101000000" dateFin=""/><Concept code="EM" displayName="Très urgent" codeSystem="2.16.840.1.113883.5.7" dateValid="20100101000000" dateFin=""/><Concept code="P" displayName="A réaliser avant l'intervention" codeSystem="2.16.840.1.113883.5.7" dateValid="20100101000000" dateFin=""/><Concept code="PRN" displayName="Si nécessaire" codeSystem="2.16.840.1.113883.5.7" dateValid="20100101000000" dateFin=""/><Concept code="R" displayName="A réaliser aux heures ouvrées" codeSystem="2.16.840.1.113883.5.7" dateValid="20100101000000" dateFin=""/><Concept code="S" displayName="Immédiatement" codeSystem="2.16.840.1.113883.5.7" dateValid="20100101000000" dateFin=""/><Concept code="T" displayName="Plannification à respecter" codeSystem="2.16.840.1.113883.5.7" dateValid="20100101000000" dateFin=""/><Concept code="UR" displayName="Urgent" codeSystem="2.16.840.1.113883.5.7" dateValid="20100101000000" dateFin=""/></ConceptList></ValueSet></RetrieveValueSetResponse>
