<?xml version="1.0" encoding="UTF-8"?>
<!--Créé par nmahraz, le 12/09/2022-->
<RetrieveValueSetResponse xmlns:xsi="http://www.w3.org/2001/XMLSchema-instance" xsi:schemaLocation="urn:ihe:iti:svs:2008 SVS.xsd" xmlns="urn:ihe:iti:svs:2008"><ValueSet id="2.16.840.1.113883.1.11.19724" displayName="JDV_HL7_HumanSubstanceAdministrationSite-CISIS" version="test"><ConceptList><Concept code="BE" displayName="dans les deux oreilles" codeSystem="2.16.840.1.113883.5.1052" dateValid="20100101000000" dateFin=""/><Concept code="BN" displayName="dans les deux narines" codeSystem="2.16.840.1.113883.5.1052" dateValid="20100101000000" dateFin=""/><Concept code="BU" displayName="fesse" codeSystem="2.16.840.1.113883.5.1052" dateValid="20100101000000" dateFin=""/><Concept code="LA" displayName="bras gauche" codeSystem="2.16.840.1.113883.5.1052" dateValid="20100101000000" dateFin=""/><Concept code="LAC" displayName="poitrine antérieure gauche" codeSystem="2.16.840.1.113883.5.1052" dateValid="20100101000000" dateFin=""/><Concept code="LACF" displayName="région cubitale antérieure gauche" codeSystem="2.16.840.1.113883.5.1052" dateValid="20100101000000" dateFin=""/><Concept code="LD" displayName="deltoïde gauche" codeSystem="2.16.840.1.113883.5.1052" dateValid="20100101000000" dateFin=""/><Concept code="LE" displayName="oreille gauche" codeSystem="2.16.840.1.113883.5.1052" dateValid="20100101000000" dateFin=""/><Concept code="LEJ" displayName="jugulaire externe gauche" codeSystem="2.16.840.1.113883.5.1052" dateValid="20100101000000" dateFin=""/><Concept code="LF" displayName="pied gauche" codeSystem="2.16.840.1.113883.5.1052" dateValid="20100101000000" dateFin=""/><Concept code="LG" displayName="muscle moyen fessier gauche" codeSystem="2.16.840.1.113883.5.1052" dateValid="20100101000000" dateFin=""/><Concept code="LH" displayName="main gauche" codeSystem="2.16.840.1.113883.5.1052" dateValid="20100101000000" dateFin=""/><Concept code="LIJ" displayName="jugulaire interne gauche" codeSystem="2.16.840.1.113883.5.1052" dateValid="20100101000000" dateFin=""/><Concept code="LLAQ" displayName="quadrant inférieur gauche de l'abdomen" codeSystem="2.16.840.1.113883.5.1052" dateValid="20100101000000" dateFin=""/><Concept code="LLFA" displayName="avant-bras inférieur gauche" codeSystem="2.16.840.1.113883.5.1052" dateValid="20100101000000" dateFin=""/><Concept code="LMFA" displayName="avant-bras moyen gauche" codeSystem="2.16.840.1.113883.5.1052" dateValid="20100101000000" dateFin=""/><Concept code="LN" displayName="narine gauche" codeSystem="2.16.840.1.113883.5.1052" dateValid="20100101000000" dateFin=""/><Concept code="LPC" displayName="poitrine postérieure gauche" codeSystem="2.16.840.1.113883.5.1052" dateValid="20100101000000" dateFin=""/><Concept code="LSC" displayName="sous-clavière gauche" codeSystem="2.16.840.1.113883.5.1052" dateValid="20100101000000" dateFin=""/><Concept code="LT" displayName="cuisse gauche" codeSystem="2.16.840.1.113883.5.1052" dateValid="20100101000000" dateFin=""/><Concept code="LUA" displayName="bras supérieur gauche" codeSystem="2.16.840.1.113883.5.1052" dateValid="20100101000000" dateFin=""/><Concept code="LUAQ" displayName="quadrant supérieur gauche de l'abdomen" codeSystem="2.16.840.1.113883.5.1052" dateValid="20100101000000" dateFin=""/><Concept code="LUFA" displayName="avant-bras supérieur gauche" codeSystem="2.16.840.1.113883.5.1052" dateValid="20100101000000" dateFin=""/><Concept code="LVG" displayName="muscle fessier antérieur gauche" codeSystem="2.16.840.1.113883.5.1052" dateValid="20100101000000" dateFin=""/><Concept code="LVL" displayName="muscle vaste externe gauche" codeSystem="2.16.840.1.113883.5.1052" dateValid="20100101000000" dateFin=""/><Concept code="OD" displayName="oeil droit" codeSystem="2.16.840.1.113883.5.1052" dateValid="20100101000000" dateFin=""/><Concept code="OS" displayName="oeil gauche" codeSystem="2.16.840.1.113883.5.1052" dateValid="20100101000000" dateFin=""/><Concept code="OU" displayName="dans les deux yeux" codeSystem="2.16.840.1.113883.5.1052" dateValid="20100101000000" dateFin=""/><Concept code="PA" displayName="péri-anal" codeSystem="2.16.840.1.113883.5.1052" dateValid="20100101000000" dateFin=""/><Concept code="PERIN" displayName="périnéal" codeSystem="2.16.840.1.113883.5.1052" dateValid="20100101000000" dateFin=""/><Concept code="RA" displayName="bras droit" codeSystem="2.16.840.1.113883.5.1052" dateValid="20100101000000" dateFin=""/><Concept code="RAC" displayName="poitrine antérieure droite" codeSystem="2.16.840.1.113883.5.1052" dateValid="20100101000000" dateFin=""/><Concept code="RACF" displayName="région cubitale antérieure droite" codeSystem="2.16.840.1.113883.5.1052" dateValid="20100101000000" dateFin=""/><Concept code="RD" displayName="deltoïde droit" codeSystem="2.16.840.1.113883.5.1052" dateValid="20100101000000" dateFin=""/><Concept code="RE" displayName="oreille droite" codeSystem="2.16.840.1.113883.5.1052" dateValid="20100101000000" dateFin=""/><Concept code="REJ" displayName="jugulaire externe droite" codeSystem="2.16.840.1.113883.5.1052" dateValid="20100101000000" dateFin=""/><Concept code="RF" displayName="pied droit" codeSystem="2.16.840.1.113883.5.1052" dateValid="20100101000000" dateFin=""/><Concept code="RG" displayName="muscle moyen fessier droite" codeSystem="2.16.840.1.113883.5.1052" dateValid="20100101000000" dateFin=""/><Concept code="RH" displayName="main droite" codeSystem="2.16.840.1.113883.5.1052" dateValid="20100101000000" dateFin=""/><Concept code="RIJ" displayName="jugulaire interne droite" codeSystem="2.16.840.1.113883.5.1052" dateValid="20100101000000" dateFin=""/><Concept code="RLAQ" displayName="quadrant inférieur droit de l'abdomen" codeSystem="2.16.840.1.113883.5.1052" dateValid="20100101000000" dateFin=""/><Concept code="RLFA" displayName="avant-bras inférieur droite" codeSystem="2.16.840.1.113883.5.1052" dateValid="20100101000000" dateFin=""/><Concept code="RMFA" displayName="avant-bras moyen droit" codeSystem="2.16.840.1.113883.5.1052" dateValid="20100101000000" dateFin=""/><Concept code="RN" displayName="narine droite" codeSystem="2.16.840.1.113883.5.1052" dateValid="20100101000000" dateFin=""/><Concept code="RPC" displayName="poitrine postérieure droite" codeSystem="2.16.840.1.113883.5.1052" dateValid="20100101000000" dateFin=""/><Concept code="RSC" displayName="sous-clavière droite" codeSystem="2.16.840.1.113883.5.1052" dateValid="20100101000000" dateFin=""/><Concept code="RT" displayName="cuisse droite" codeSystem="2.16.840.1.113883.5.1052" dateValid="20100101000000" dateFin=""/><Concept code="RUA" displayName="bras supérieur droit" codeSystem="2.16.840.1.113883.5.1052" dateValid="20100101000000" dateFin=""/><Concept code="RUAQ" displayName="quadrant supérieur droit de l'abdomen" codeSystem="2.16.840.1.113883.5.1052" dateValid="20100101000000" dateFin=""/><Concept code="RUFA" displayName="avant-bras supérieur droite" codeSystem="2.16.840.1.113883.5.1052" dateValid="20100101000000" dateFin=""/><Concept code="RVG" displayName="muscle fessier antérieur droit" codeSystem="2.16.840.1.113883.5.1052" dateValid="20100101000000" dateFin=""/><Concept code="RVL" displayName="muscle vaste externe droit" codeSystem="2.16.840.1.113883.5.1052" dateValid="20100101000000" dateFin=""/></ConceptList></ValueSet></RetrieveValueSetResponse>
