<?xml version="1.0" encoding="UTF-8"?>
<!--Créé par nmahraz, le 12/09/2022-->
<RetrieveValueSetResponse xmlns:xsi="http://www.w3.org/2001/XMLSchema-instance" xsi:schemaLocation="urn:ihe:iti:svs:2008 SVS.xsd" xmlns="urn:ihe:iti:svs:2008"><ValueSet id="1.2.250.1.213.1.1.5.541" displayName="JDV_ExamenMicroscopiqueTumeurTypeHistologique_CISIS" version="test"><ConceptList><Concept code="C2852" displayName="Adénocarcinome (sans aspect histologique particulier)" codeSystem="2.16.840.1.113883.3.26.1.1" dateValid="20210101000000" dateFin=""/><Concept code="C26712" displayName="Adénocarcinome mucineux" codeSystem="2.16.840.1.113883.3.26.1.1" dateValid="20210101000000" dateFin=""/><Concept code="C3774" displayName="Carcinome à cellules en bague à chaton" codeSystem="2.16.840.1.113883.3.26.1.1" dateValid="20210101000000" dateFin=""/><Concept code="C8998" displayName="Carcinome médullaire" codeSystem="2.16.840.1.113883.3.26.1.1" dateValid="20210101000000" dateFin=""/><Concept code="MED-708" displayName="Adénocarcinome festonné" codeSystem="1.2.250.1.213.1.1.4.322" dateValid="20210101000000" dateFin=""/><Concept code="C96491" displayName="Adénocarcinome micropapillaire" codeSystem="2.16.840.1.113883.3.26.1.1" dateValid="20210101000000" dateFin=""/><Concept code="C172699" displayName="Adénocarcinome &quot;adenoma-like&quot;" codeSystem="2.16.840.1.113883.3.26.1.1" dateValid="20210101000000" dateFin=""/><Concept code="C3727" displayName="Carcinome adénosquameux" codeSystem="2.16.840.1.113883.3.26.1.1" dateValid="20210101000000" dateFin=""/><Concept code="C96494" displayName="Carcinome avec composante sarcomatoïde" codeSystem="2.16.840.1.113883.3.26.1.1" dateValid="20210101000000" dateFin=""/><Concept code="C3692" displayName="Carcinome indifférencié" codeSystem="2.16.840.1.113883.3.26.1.1" dateValid="20210101000000" dateFin=""/><Concept code="MED-714" displayName="Autre carcinome" codeSystem="1.2.250.1.213.1.1.4.322" dateValid="20210101000000" dateFin=""/><Concept code="MED-715" displayName="TNE / TNE et non NE" codeSystem="1.2.250.1.213.1.1.4.322" dateValid="20210101000000" dateFin=""/><Concept code="MED-716" displayName="Tumeur lymphoïde" codeSystem="1.2.250.1.213.1.1.4.322" dateValid="20210101000000" dateFin=""/><Concept code="C3868" displayName="GIST" codeSystem="2.16.840.1.113883.3.26.1.1" dateValid="20210101000000" dateFin=""/><Concept code="MED-718" displayName="Tumeur mésenchymateuse (hors GIST)" codeSystem="1.2.250.1.213.1.1.4.322" dateValid="20210101000000" dateFin=""/><Concept code="C19151" displayName="Métastase" codeSystem="2.16.840.1.113883.3.26.1.1" dateValid="20210101000000" dateFin=""/></ConceptList></ValueSet></RetrieveValueSetResponse>
