<?xml version="1.0" encoding="UTF-8"?>
<!--Créé par nmahraz, le 12/09/2022-->
<RetrieveValueSetResponse xmlns:xsi="http://www.w3.org/2001/XMLSchema-instance" xsi:schemaLocation="urn:ihe:iti:svs:2008 SVS.xsd" xmlns="urn:ihe:iti:svs:2008"><ValueSet id="1.2.250.1.213.1.1.5.228" displayName="JDV_TypeActeEUVN-CISIS" version="test"><ConceptList><Concept code="P1-30330" displayName="Endartériectomie" codeSystem="1.2.250.1.213.2.12" dateValid="20100101000000" dateFin=""/><Concept code="P1-30800" displayName="Angioplastie" codeSystem="1.2.250.1.213.2.12" dateValid="20100101000000" dateFin=""/><Concept code="P1-91300" displayName="Crâniectomie" codeSystem="1.2.250.1.213.2.12" dateValid="20100101000000" dateFin=""/><Concept code="P1-91221" displayName="Evacuation hématome intracérébral" codeSystem="1.2.250.1.213.2.12" dateValid="20100101000000" dateFin=""/><Concept code="MED-512" displayName="Pose Valve / Dérivation externe" codeSystem="1.2.250.1.213.1.1.4.322" dateValid="20100101000000" dateFin=""/></ConceptList></ValueSet></RetrieveValueSetResponse>
