<?xml version="1.0" encoding="UTF-8"?>
<!--Créé par nmahraz, le 12/09/2022-->
<RetrieveValueSetResponse xmlns:xsi="http://www.w3.org/2001/XMLSchema-instance" xsi:schemaLocation="urn:ihe:iti:svs:2008 SVS.xsd" xmlns="urn:ihe:iti:svs:2008"><ValueSet id="1.2.250.1.213.1.1.5.178" displayName="JDV_NIHSSFonction-CISIS" version="test"><ConceptList><Concept code="70184-7" displayName="Niveau conscience [NIHSS]" codeSystem="2.16.840.1.113883.6.1" dateValid="20100101000000" dateFin=""/><Concept code="70185-4" displayName="LOC Questions [NIHSS]" codeSystem="2.16.840.1.113883.6.1" dateValid="20100101000000" dateFin=""/><Concept code="70186-2" displayName="LOC Commandes [NIHSS]" codeSystem="2.16.840.1.113883.6.1" dateValid="20100101000000" dateFin=""/><Concept code="70187-0" displayName="Occulomotricité [NIHSS]" codeSystem="2.16.840.1.113883.6.1" dateValid="20100101000000" dateFin=""/><Concept code="70188-8" displayName="Champ visuel [NIHSS]" codeSystem="2.16.840.1.113883.6.1" dateValid="20100101000000" dateFin=""/><Concept code="70189-6" displayName="Paralysie faciale [NIHSS]" codeSystem="2.16.840.1.113883.6.1" dateValid="20100101000000" dateFin=""/><Concept code="70967-5" displayName="motricité MSD [NIHSS]" codeSystem="2.16.840.1.113883.6.1" dateValid="20100101000000" dateFin=""/><Concept code="70190-4" displayName="motricité MSG [NIHSS]" codeSystem="2.16.840.1.113883.6.1" dateValid="20100101000000" dateFin=""/><Concept code="70968-3" displayName="motricité MID [NIHSS]" codeSystem="2.16.840.1.113883.6.1" dateValid="20100101000000" dateFin=""/><Concept code="70191-2" displayName="motricité MIG [NIHSS]" codeSystem="2.16.840.1.113883.6.1" dateValid="20100101000000" dateFin=""/><Concept code="70192-0" displayName="Ataxie des membres [NIHSS]" codeSystem="2.16.840.1.113883.6.1" dateValid="20100101000000" dateFin=""/><Concept code="70193-8" displayName="Sensibilité [NIHSS]" codeSystem="2.16.840.1.113883.6.1" dateValid="20100101000000" dateFin=""/><Concept code="70194-6" displayName="Meilleur langage [NIHSS]" codeSystem="2.16.840.1.113883.6.1" dateValid="20100101000000" dateFin=""/><Concept code="70195-3" displayName="Dysarthrie [NIHSS]" codeSystem="2.16.840.1.113883.6.1" dateValid="20100101000000" dateFin=""/><Concept code="70196-1" displayName="Extinction ou négligence [NIHSS]" codeSystem="2.16.840.1.113883.6.1" dateValid="20100101000000" dateFin=""/></ConceptList></ValueSet></RetrieveValueSetResponse>
