<?xml version="1.0" encoding="ISO-8859-1"?>
<!--Créé par nmahraz, le 09/03/2022-->
<RetrieveValueSetResponse xmlns:xsi="http://www.w3.org/2001/XMLSchema-instance" xsi:schemaLocation="urn:ihe:iti:svs:2008 SVS.xsd" xmlns="urn:ihe:iti:svs:2008"><ValueSet id="1.2.250.1.213.1.1.5.108" displayName="JDV_NiveauEtude-CISIS" version="test"><ConceptList><Concept code="PAT-035" displayName="Ecole primaire" codeSystem="1.2.250.1.213.1.1.4.322"/><Concept code="PAT-036" displayName="Collège" codeSystem="1.2.250.1.213.1.1.4.322"/><Concept code="PAT-037" displayName="Lycée" codeSystem="1.2.250.1.213.1.1.4.322"/><Concept code="PAT-038" displayName="Bac +1 ou +2" codeSystem="1.2.250.1.213.1.1.4.322"/><Concept code="PAT-039" displayName="Bac +3 et +" codeSystem="1.2.250.1.213.1.1.4.322"/></ConceptList></ValueSet></RetrieveValueSetResponse>
